{
    "key": "taxonomy_blog_categories",
    "title": "Blog categories",
    "taxonomy": "blog_categories",
    "object_type": [
        "blog"
    ],
    "active": true,
    "rewrite": {
        "permalink_rewrite": "custom_permalink",
        "slug": "blog/kategorie",
        "with_front": "1",
        "rewrite_hierarchical": "0"
    }
}
